[{"$uri": "/api/v1_experimental/functional_profiles/eec4ac90d9104d1e", "complete": true, "created_at": "2022-05-25T17:27:30.622286-07:00", "error_msg": "", "job": {"$ref": "/api/v1/jobs/59e7904ea8ed4202"}, "sample": {"$ref": "/api/v1/samples/37e5151e7bcb4f87"}, "success": true}, {"$uri": "/api/v1_experimental/functional_profiles/bde18eb9407d4c2f", "complete": true, "created_at": "2022-05-25T17:27:30.622286-07:00", "error_msg": "", "job": {"$ref": "/api/v1/jobs/59e7904ea8ed4202"}, "sample": {"$ref": "/api/v1/samples/66c1531cb0b244f6"}, "success": true}, {"$uri": "/api/v1_experimental/functional_profiles/31ddae978aff475f", "complete": true, "created_at": "2022-05-25T17:27:30.622286-07:00", "error_msg": "", "job": {"$ref": "/api/v1/jobs/59e7904ea8ed4202"}, "sample": {"$ref": "/api/v1/samples/543c9c046e3e4e09"}, "success": true}]
